A1: 2010年度 試合結果（1年時） | I1: =COUNTIF(H4:H11,"○")+COUNTIF(H4:H11,"●")+COUNTIF(H4:H11,"△")&"戦"&COUNTIF(H4:H11,"○") &"勝"&COUNTIF(H4:H11,"●") &"敗"&COUNTIF(H4:H11,"△")&"分" -> 3戦1勝1敗1分
A3: No. | B3: 大会日 | C3: 大会名 | D3: 対戦相手 | E3: スコア | H3: 勝敗 | I3: 備考
A4: 1 | B4: 2010年ネン | F4: − | H4: ○ | I4: 11人制ニンセイ15分フン1本ポン
A5: =A4+1 -> 2 | B5: 40269 | F5: − | H5: △
A6: =A5+1 -> 3 | F6: − | H6: ●
A7: =A6+1 -> 4 | F7: −
A8: =A7+1 -> 5 | F8: −
A9: =A8+1 -> 6 | F9: −